{
    "schema": "meti",
    "dmpType": "New",
    "agreementTitle": "The Data Management Plan",
    "agreementDate": "2021-09-20",
    "submitDate": "2021-10-01",
    "corporateName": "The Corporate",
    "researches": [
        {
            "index": 1,
            "title": "The Research Data",
            "description": "This is description.",
            "manager": "John Doe",
            "dataType": "My Data",
            "releaseLevel": 4,
            "concealReason": "nothing",
            "concealPeriod": "",
            "acquirer": "John Lab",
            "acquireMethod": "by download link",
            "remarks": ""
        },
        {
            "index": 2,
            "title": "The Research Data2",
            "description": "This is description.",
            "manager": "Jumpei Kuwata",
            "dataType": "My Data",
            "releaseLevel": 4,
            "concealReason": "nothing",
            "concealPeriod": "",
            "acquirer": "IVIS Lab",
            "acquireMethod": "by download link",
            "remarks": ""
        }
    ]
}
